{
  "$schema": "../../../schemas/case.schema.json",
  "schema_version": "1",
  "id": "performance.parser.content-only",
  "title": "Prepared content-only parser micro-performance",
  "description": "Parse and semantically project identical fixed bytes through a reusable parser derived from the pinned, content-only PreparedChat; fixture I/O, preparation, generation, and streaming are absent from timing.",
  "category": "performance",
  "primitive": "P8",
  "adapter": "differential",
  "operation": "chat-parser.bench",
  "status": "active",
  "tags": ["model-free", "prepared-chat", "same-work"],
  "prerequisites": ["correctness.parser.content-only-unicode"],
  "source": {
    "kind": "x-cli-defined",
    "note": "The explicit ChatML template is prepared with use_jinja=false and force_pure_content=true so this case remains truthfully content-only; PEG-native parser performance is a separate future vector."
  },
  "inputs": {
    "template_fixture": "fixtures/templates/chatml-basic.jinja",
    "input_fixture": "fixtures/templates/chatml-basic-input.json",
    "content_fixture": "fixtures/parser/content-replay.json",
    "use_jinja": false,
    "force_pure_content": true,
    "parser_options": {
      "reasoning_in_content": false,
      "parse_tool_calls": false,
      "is_continuation": false,
      "echo": false,
      "debug": false
    },
    "warmup_iterations": 10,
    "iterations": 1000
  },
  "requirements": {
    "offline": true,
    "fixtures": [
      { "id": "content-replay", "path": "fixtures/parser/content-replay.json", "sha256": "73c40bd90e63e3b51f10524e675cb18f43e32ac2227720a50125a1184e22cf69" },
      { "id": "chatml-basic-template", "path": "fixtures/templates/chatml-basic.jinja", "sha256": "f26fd6284d6bc05d057a4b5800e2a268a85df6546edf484d979e23a51ed7886d" },
      { "id": "chatml-basic-input", "path": "fixtures/templates/chatml-basic-input.json", "sha256": "31c9ce9978be560f49d12179b4600fa23c8fff9948a4412beab006671b188fba" }
    ],
    "model": null,
    "capabilities": ["common-chat", "chat-parser.content-only"]
  },
  "invocations": {
    "reference": { "kind": "native-oracle", "target": "oracle", "operation": "chat-parser.bench" },
    "candidate": { "kind": "icn-probe", "target": "icn-probe", "operation": "chat-parser.bench" }
  },
  "comparison": {
    "kind": "performance-ratio",
    "metric": "duration",
    "statistic": "median",
    "maximum_ratio": 1.03,
    "direction": "candidate-over-reference",
    "exact_output_paths": [""]
  },
  "timing": {
    "included": ["reusable prepared parser final parse", "semantic result projection"],
    "excluded": ["fixture loading", "template construction", "chat preparation", "parser construction", "generation", "network streaming", "result serialization"],
    "warmup_iterations": 10,
    "measurement_iterations": 1000,
    "synchronize": false
  }
}
